{
  "schema_version": "neutral-dependency-closure-v1",
  "baseline_commit": "289bfbf4c5c312e8fec4c639a62193a4a5d47453",
  "source_commit_policy": "RESOLVE_EXACT_COMMIT_ARGUMENT_AT_BUILD",
  "project": {
    "id": "new-neutral-source-lane",
    "display_name": "Neutral TTS Workbench",
    "license_spdx": "MIT",
    "license_status": "APPROVED",
    "redistribution_status": "PERMITTED_UNDER_MIT",
    "notice_required": true,
    "notice_status": "PRESENT",
    "approval_status": "APPROVED",
    "approval_authority": "rtonf",
    "public_distribution": false
  },
  "policy": {
    "allowed_audiences": [
      "INTERNAL_SOURCE_REVIEW"
    ],
    "public_bundle_requires_approval": true,
    "source_only": true
  },
  "source_candidate": {
    "audience": "INTERNAL_SOURCE_REVIEW",
    "public_distribution": false,
    "reason": "Internal candidate verification; public upload and external payload decisions remain separate from the MIT source license."
  },
  "components": [
    {
      "component_id": "project-source",
      "display_name": "Neutral TTS Workbench source",
      "kind": "source",
      "source_url": null,
      "wheel_url": null,
      "source_commit_or_version": "RESOLVED_AT_BUILD_FROM_EXACT_COMMIT_ARGUMENT",
      "sha256": null,
      "license_spdx": "MIT",
      "license_status": "APPROVED",
      "redistribution_status": "PERMITTED_UNDER_MIT",
      "notice_required": true,
      "notice_status": "PRESENT",
      "approval_status": "APPROVED",
      "approval_authority": "rtonf",
      "bundle": true,
      "bundle_reason": "Source-only internal review candidate; not a third-party payload."
    },
    {
      "component_id": "irodori-tts-compatibility",
      "display_name": "Irodori-TTS compatible engine boundary",
      "kind": "vendor-source-and-runtime",
      "source_url": "https://codeload.github.com/Aratako/Irodori-TTS/zip/8ca3acb58ab4e19ad6d594aaed6bafe3e88f7f71",
      "wheel_url": "https://codeload.github.com/Aratako/Irodori-TTS/zip/8ca3acb58ab4e19ad6d594aaed6bafe3e88f7f71",
      "source_commit_or_version": "0.1.0+ntts.8ca3acb58ab4",
      "sha256": "f5fccadc766bfee753cbb18f651cc36ec5ee30246c5bd9c2a8844c495c12b54a",
      "license_spdx": "MIT",
      "license_status": "OFFICIAL_FIXED_SOURCE_REVIEWED",
      "redistribution_status": "NOT_APPROVED",
      "notice_required": true,
      "notice_status": "SEE_INFERENCE_COMPONENTS_AND_ORIGINAL_LICENSE",
      "approval_status": "NOT_APPROVED",
      "approval_authority": null,
      "bundle": false,
      "bundle_reason": "Separately acquired for local execution under docs/INFERENCE_COMPONENTS.md; redistribution of the runtime or weights is outside this source-layout distribution."
    },
    {
      "component_id": "silentcipher-checkpoint",
      "display_name": "SilentCipher checkpoint",
      "kind": "model-checkpoint",
      "source_url": null,
      "wheel_url": null,
      "source_commit_or_version": null,
      "sha256": null,
      "license_spdx": "NOASSERTION",
      "license_status": "NOT_APPROVED",
      "redistribution_status": "NOT_APPROVED",
      "notice_required": null,
      "notice_status": "UNKNOWN_PENDING_EXACT_LICENSE",
      "approval_status": "NOT_APPROVED",
      "approval_authority": null,
      "bundle": false,
      "bundle_reason": "Model payload is explicitly excluded from this source-only lane."
    },
    {
      "component_id": "modernbert-ja-tokenizer",
      "display_name": "sbintuitions/modernbert-ja-310m tokenizer assets",
      "kind": "tokenizer",
      "source_url": null,
      "wheel_url": null,
      "source_commit_or_version": null,
      "sha256": null,
      "license_spdx": "NOASSERTION",
      "license_status": "NOT_APPROVED",
      "redistribution_status": "NOT_APPROVED",
      "notice_required": null,
      "notice_status": "UNKNOWN_PENDING_EXACT_LICENSE",
      "approval_status": "NOT_APPROVED",
      "approval_authority": null,
      "bundle": false,
      "bundle_reason": "Tokenizer payload is explicitly excluded from this source-only lane."
    },
    {
      "component_id": "semantic-dacvae-codec",
      "display_name": "semantic-dacvae-japanese-32dim codec weights",
      "kind": "codec-weights",
      "source_url": "https://huggingface.co/Aratako/Semantic-DACVAE-Japanese-32dim",
      "wheel_url": "https://huggingface.co/Aratako/Semantic-DACVAE-Japanese-32dim/resolve/47376ee24834d7a05a48ebabfe3cde29b3c5e214/weights.pth",
      "source_commit_or_version": "47376ee24834d7a05a48ebabfe3cde29b3c5e214",
      "sha256": "db120339c5ee7eca1912cdf29bc612b947a0808e69c3cebfb4936b45a762c1d5",
      "license_spdx": "MIT",
      "license_status": "OFFICIAL_FIXED_SOURCE_REVIEWED",
      "redistribution_status": "NOT_APPROVED",
      "notice_required": true,
      "notice_status": "SEE_INFERENCE_COMPONENTS_AND_ORIGINAL_LICENSE",
      "approval_status": "NOT_APPROVED",
      "approval_authority": null,
      "bundle": false,
      "bundle_reason": "Separately acquired for local execution under docs/INFERENCE_COMPONENTS.md; redistribution of the runtime or weights is outside this source-layout distribution."
    },
    {
      "component_id": "sounddevice",
      "display_name": "sounddevice playback package",
      "kind": "python-playback-package",
      "source_url": null,
      "wheel_url": null,
      "source_commit_or_version": null,
      "sha256": null,
      "license_spdx": "MIT",
      "license_status": "NOT_APPROVED",
      "redistribution_status": "NOT_APPROVED_FOR_PUBLIC_RELEASE",
      "notice_required": true,
      "notice_status": "REQUIRED_NOTICE_NOT_COLLECTED",
      "approval_status": "NOT_APPROVED",
      "approval_authority": null,
      "bundle": false,
      "bundle_reason": "Playback dependency is not approved for redistribution."
    },
    {
      "component_id": "portaudio",
      "display_name": "PortAudio native playback library",
      "kind": "native-playback-library",
      "source_url": null,
      "wheel_url": null,
      "source_commit_or_version": null,
      "sha256": null,
      "license_spdx": "MIT",
      "license_status": "NOT_APPROVED",
      "redistribution_status": "NOT_APPROVED_FOR_PUBLIC_RELEASE",
      "notice_required": true,
      "notice_status": "REQUIRED_NOTICE_NOT_COLLECTED",
      "approval_status": "NOT_APPROVED",
      "approval_authority": null,
      "bundle": false,
      "bundle_reason": "Native playback dependency is not approved for redistribution."
    },
    {
      "component_id": "python-cuda-native-runtime",
      "display_name": "Python, CUDA, and native runtime closure",
      "kind": "runtime-closure",
      "source_url": null,
      "wheel_url": null,
      "source_commit_or_version": null,
      "sha256": null,
      "license_spdx": "NOASSERTION",
      "license_status": "NOT_REVIEWED",
      "redistribution_status": "NOT_REVIEWED",
      "notice_required": null,
      "notice_status": "UNKNOWN_PENDING_EXACT_CLOSURE",
      "approval_status": "NOT_APPROVED",
      "approval_authority": null,
      "bundle": false,
      "bundle_reason": "Runtime closure is outside source-only scope and has not been reviewed."
    },
    {
      "component_id": "alternative-voice-assets",
      "display_name": "Alternative voice profiles and reference audio",
      "kind": "voice-assets",
      "source_url": null,
      "wheel_url": null,
      "source_commit_or_version": null,
      "sha256": null,
      "license_spdx": "NOASSERTION",
      "license_status": "RIGHTS_AND_CONSENT_REQUIRED",
      "redistribution_status": "RIGHTS_AND_CONSENT_REQUIRED",
      "notice_required": null,
      "notice_status": "UNKNOWN_PENDING_RIGHTS_REVIEW",
      "approval_status": "NOT_APPROVED",
      "approval_authority": null,
      "bundle": false,
      "bundle_reason": "Voice assets require separate rights and consent review."
    }
  ]
}
